{
  "attempts": [
    {
      "condition": "reactive",
      "condition_plan_path": "experiments/EXP-0001-sira-simulative-vs-reactive/run-plans/conditions/pilot-v10-task-0000-reactive.yaml",
      "condition_plan_sha256": "778b907fe4a7910558b8e439847f01a0beb0fd2297606f94a52e5679f617a278",
      "config_sha256": "cf25acd90f9d73d9aef978a7d059cfbc74a1447d901f4e3d27e2b5d9f121d2ed",
      "environment_sha256": "779a144e4de01dbf1e98659ac8ec853d34506caab5e801631a3c99c405d30c0a",
      "finalized_output_root": "artifacts/EXP-0001/pilot-v10/task-a/reactive/attempt-autonomous-0003/finalized",
      "giclab_commit": "503def0519e36f04b62b16158c72e11213b3bf9f",
      "order_index": 1,
      "output_root": "artifacts/EXP-0001/pilot-v10/task-a/reactive/attempt-autonomous-0003",
      "pair_id": "PAIR-EXP0001-PILOT-V10-TASK-A",
      "protocol_sha256": "5356fc8b3806f4135eb570f65b67da2f94463582db5e3e609320e23dbdb2a3f7",
      "raw_output_root": "artifacts/EXP-0001/pilot-v10/task-a/reactive/attempt-autonomous-0003/raw",
      "run_id": "RUN-T09-TASK-A-REACTIVE-AUTONOMOUS-0003",
      "task_id": "7dcbbbdc7f1120cd",
      "task_index": 0,
      "upstream_argv": [
        "EXP-0001-PILOT-V10-TASK-A-REACTIVE",
        "--dataset",
        "fanout",
        "--mode",
        "reactive",
        "--agent",
        "sira",
        "--config_name",
        "web_reactive",
        "--model",
        "gpt-4o-2024-11-20",
        "--max_steps",
        "30",
        "--timeout",
        "30",
        "--max_retry",
        "0",
        "--data_root",
        "/opt/sira/data",
        "--output_dir",
        "/opt/giclab-artifacts/artifacts/EXP-0001/pilot-v10/task-a/reactive/attempt-autonomous-0003/raw/sira-output",
        "--start_idx",
        "0",
        "--end_idx",
        "1",
        "--seed",
        "42"
      ]
    },
    {
      "condition": "simulative",
      "condition_plan_path": "experiments/EXP-0001-sira-simulative-vs-reactive/run-plans/conditions/pilot-v10-task-0000-simulative.yaml",
      "condition_plan_sha256": "744d122717fa0530c0100ff512dacc37da47df452a2a34077844b1100b1ff59b",
      "config_sha256": "cf25acd90f9d73d9aef978a7d059cfbc74a1447d901f4e3d27e2b5d9f121d2ed",
      "environment_sha256": "779a144e4de01dbf1e98659ac8ec853d34506caab5e801631a3c99c405d30c0a",
      "finalized_output_root": "artifacts/EXP-0001/pilot-v10/task-a/simulative/attempt-autonomous-0003/finalized",
      "giclab_commit": "503def0519e36f04b62b16158c72e11213b3bf9f",
      "order_index": 2,
      "output_root": "artifacts/EXP-0001/pilot-v10/task-a/simulative/attempt-autonomous-0003",
      "pair_id": "PAIR-EXP0001-PILOT-V10-TASK-A",
      "protocol_sha256": "5356fc8b3806f4135eb570f65b67da2f94463582db5e3e609320e23dbdb2a3f7",
      "raw_output_root": "artifacts/EXP-0001/pilot-v10/task-a/simulative/attempt-autonomous-0003/raw",
      "run_id": "RUN-T09-TASK-A-SIMULATIVE-AUTONOMOUS-0003",
      "task_id": "7dcbbbdc7f1120cd",
      "task_index": 0,
      "upstream_argv": [
        "EXP-0001-PILOT-V10-TASK-A-SIMULATIVE",
        "--dataset",
        "fanout",
        "--mode",
        "simulative",
        "--agent",
        "sira",
        "--config_name",
        "web_simulative",
        "--model",
        "gpt-4o-2024-11-20",
        "--max_steps",
        "30",
        "--timeout",
        "30",
        "--max_retry",
        "0",
        "--data_root",
        "/opt/sira/data",
        "--output_dir",
        "/opt/giclab-artifacts/artifacts/EXP-0001/pilot-v10/task-a/simulative/attempt-autonomous-0003/raw/sira-output",
        "--start_idx",
        "0",
        "--end_idx",
        "1",
        "--seed",
        "42"
      ]
    },
    {
      "condition": "simulative",
      "condition_plan_path": "experiments/EXP-0001-sira-simulative-vs-reactive/run-plans/conditions/pilot-v10-task-0001-simulative.yaml",
      "condition_plan_sha256": "decd0ebf6fd64aad7f4a19929ebb194909a084a46341961b0c87eb65cf9eb0ab",
      "config_sha256": "cf25acd90f9d73d9aef978a7d059cfbc74a1447d901f4e3d27e2b5d9f121d2ed",
      "environment_sha256": "779a144e4de01dbf1e98659ac8ec853d34506caab5e801631a3c99c405d30c0a",
      "finalized_output_root": "artifacts/EXP-0001/pilot-v10/task-b/simulative/attempt-autonomous-0003/finalized",
      "giclab_commit": "503def0519e36f04b62b16158c72e11213b3bf9f",
      "order_index": 1,
      "output_root": "artifacts/EXP-0001/pilot-v10/task-b/simulative/attempt-autonomous-0003",
      "pair_id": "PAIR-EXP0001-PILOT-V10-TASK-B",
      "protocol_sha256": "5356fc8b3806f4135eb570f65b67da2f94463582db5e3e609320e23dbdb2a3f7",
      "raw_output_root": "artifacts/EXP-0001/pilot-v10/task-b/simulative/attempt-autonomous-0003/raw",
      "run_id": "RUN-T09-TASK-B-SIMULATIVE-AUTONOMOUS-0003",
      "task_id": "2120afba8009bad3",
      "task_index": 1,
      "upstream_argv": [
        "EXP-0001-PILOT-V10-TASK-B-SIMULATIVE",
        "--dataset",
        "fanout",
        "--mode",
        "simulative",
        "--agent",
        "sira",
        "--config_name",
        "web_simulative",
        "--model",
        "gpt-4o-2024-11-20",
        "--max_steps",
        "30",
        "--timeout",
        "30",
        "--max_retry",
        "0",
        "--data_root",
        "/opt/sira/data",
        "--output_dir",
        "/opt/giclab-artifacts/artifacts/EXP-0001/pilot-v10/task-b/simulative/attempt-autonomous-0003/raw/sira-output",
        "--start_idx",
        "1",
        "--end_idx",
        "2",
        "--seed",
        "42"
      ]
    },
    {
      "condition": "reactive",
      "condition_plan_path": "experiments/EXP-0001-sira-simulative-vs-reactive/run-plans/conditions/pilot-v10-task-0001-reactive.yaml",
      "condition_plan_sha256": "8786b13d0070ba947c0cc753fe3edca1aed4f6e2e5ba8d399709beb3a5464d97",
      "config_sha256": "cf25acd90f9d73d9aef978a7d059cfbc74a1447d901f4e3d27e2b5d9f121d2ed",
      "environment_sha256": "779a144e4de01dbf1e98659ac8ec853d34506caab5e801631a3c99c405d30c0a",
      "finalized_output_root": "artifacts/EXP-0001/pilot-v10/task-b/reactive/attempt-autonomous-0003/finalized",
      "giclab_commit": "503def0519e36f04b62b16158c72e11213b3bf9f",
      "order_index": 2,
      "output_root": "artifacts/EXP-0001/pilot-v10/task-b/reactive/attempt-autonomous-0003",
      "pair_id": "PAIR-EXP0001-PILOT-V10-TASK-B",
      "protocol_sha256": "5356fc8b3806f4135eb570f65b67da2f94463582db5e3e609320e23dbdb2a3f7",
      "raw_output_root": "artifacts/EXP-0001/pilot-v10/task-b/reactive/attempt-autonomous-0003/raw",
      "run_id": "RUN-T09-TASK-B-REACTIVE-AUTONOMOUS-0003",
      "task_id": "2120afba8009bad3",
      "task_index": 1,
      "upstream_argv": [
        "EXP-0001-PILOT-V10-TASK-B-REACTIVE",
        "--dataset",
        "fanout",
        "--mode",
        "reactive",
        "--agent",
        "sira",
        "--config_name",
        "web_reactive",
        "--model",
        "gpt-4o-2024-11-20",
        "--max_steps",
        "30",
        "--timeout",
        "30",
        "--max_retry",
        "0",
        "--data_root",
        "/opt/sira/data",
        "--output_dir",
        "/opt/giclab-artifacts/artifacts/EXP-0001/pilot-v10/task-b/reactive/attempt-autonomous-0003/raw/sira-output",
        "--start_idx",
        "1",
        "--end_idx",
        "2",
        "--seed",
        "42"
      ]
    }
  ],
  "authorization_reference": null,
  "authorized": false,
  "budget_calibration": {
    "basis": {
      "cleanup_poll_seal_and_transfer_reserve_required": true,
      "empirical_campaign_wall_seconds": 14400,
      "expected_steps": 18,
      "expected_wall_seconds_per_attempt": 720,
      "frozen_provider_hard_wall_seconds": 21600,
      "hard_steps": 30,
      "maximum_successful_host_active_seconds": 18000,
      "minimum_worst_case_cleanup_checkpoint_seconds": 900,
      "preflight_wall_seconds_per_launch": 3600,
      "reactive_calls_per_step_from_t07": 4,
      "reactive_openai_cost_per_step_from_t07": 0.014165,
      "reactive_tokens_per_step_from_t07": 4886,
      "simulative_calls_per_step_from_t07": 5,
      "simulative_openai_cost_per_step_from_t07": 0.0261675,
      "simulative_tokens_per_step_from_t07": 6702,
      "t07_observed_four_attempt_linear_wall_seconds": 1418.3096875199908,
      "t07_retained_successful_host_wall_seconds": 1581.905248
    },
    "expected": {
      "aggregate_lambda_cost_usd": 1.032,
      "aggregate_openai_cost_usd": 1.45197,
      "aggregate_total_cost_usd": 2.48397,
      "expected_authorization_envelope_basis": "four-attempt expected total plus the full six-hour cumulative active Lambda maximum, as required by the Retry 5 authorization",
      "expected_authorization_envelope_usd": 10.22397,
      "pair_cost_usd": 1.241985,
      "reactive_attempt": {
        "browser_actions": 18,
        "lambda_cost_usd": 0.258,
        "model_calls": 72,
        "openai_cost_usd": 0.25497,
        "tokens": 87948,
        "total_cost_usd": 0.51297
      },
      "simulative_attempt": {
        "browser_actions": 18,
        "lambda_cost_usd": 0.258,
        "model_calls": 90,
        "openai_cost_usd": 0.471015,
        "tokens": 120636,
        "total_cost_usd": 0.729015
      },
      "six_hour_lambda_maximum_usd": 7.74
    },
    "hard": {
      "aggregate_browser_actions": 120,
      "aggregate_lambda_cost_usd": 8.0,
      "aggregate_model_calls": 4620,
      "aggregate_openai_cost_usd": 40.0,
      "aggregate_tokens": 4000000,
      "aggregate_total_cost_usd": 58.0,
      "attempt_lambda_cost_usd": 1.29,
      "attempt_openai_cost_usd": 10.0,
      "attempt_total_cost_usd": 11.29,
      "candidate_ceiling_enforceable": true,
      "cumulative_t09_cost_cap_usd": 90.0,
      "enforcement_basis": "cumulative actual active Lambda seconds plus per-launch 3600-second preflight and post-manifest 13500-second empirical termination cutoff with 900-second cleanup reserve",
      "maximum_new_cost_under_cumulative_cap_usd": 60.6497004421,
      "pair_total_cost_usd": 22.58,